{
  "contract_id": "CTR-001",
  "name": "Registries Layer 1 — Main Dashboard",
  "tier": "A",
  "type": "dom_vs_contract",
  "owner": "orchestrator",
  "enabled": true,
  "contract_version": "2.0.0",
  "last_verified_at": "2026-03-23",
  "grace_seconds": 60,
  "page_url": "https://vps.incomexsaigoncorp.vn/knowledge/registries",
  "checks": [
    {
      "check_id": "CTR-001-01",
      "description": "Page title Danh mục hệ thống visible",
      "operator": "exists",
      "severity": "CRITICAL",
      "source_dom": { "selector": "Danh mục hệ thống" }
    },
    {
      "check_id": "CTR-001-02",
      "description": "CAT-ALL row text present",
      "operator": "exists",
      "severity": "CRITICAL",
      "source_dom": { "selector": "CAT-ALL" }
    },
    {
      "check_id": "CTR-001-03",
      "description": "CAT-MOL row text present",
      "operator": "exists",
      "severity": "CRITICAL",
      "source_dom": { "selector": "CAT-MOL" }
    },
    {
      "check_id": "CTR-001-04",
      "description": "CAT-SPE (Phân loại loài) present",
      "operator": "exists",
      "severity": "CRITICAL",
      "source_dom": { "selector": "CAT-SPE" }
    },
    {
      "check_id": "CTR-001-05",
      "description": "CAT-ORP (Mồ côi) present",
      "operator": "exists",
      "severity": "CRITICAL",
      "source_dom": { "selector": "CAT-ORP" }
    },
    {
      "check_id": "CTR-001-06",
      "description": "CAT-PHA (Phantom) present",
      "operator": "exists",
      "severity": "WARNING",
      "source_dom": { "selector": "CAT-PHA" }
    },
    {
      "check_id": "CTR-001-07",
      "description": "CAT-UNM (Không quản trị) present",
      "operator": "exists",
      "severity": "WARNING",
      "source_dom": { "selector": "CAT-UNM" }
    },
    {
      "check_id": "CTR-001-08",
      "description": "CAT-017 (Vấn đề Hệ thống) present — Dòng 11",
      "operator": "exists",
      "severity": "CRITICAL",
      "source_dom": { "selector": "Vấn đề Hệ thống" }
    },
    {
      "check_id": "CTR-001-09",
      "description": "Species Matrix link present",
      "operator": "exists",
      "severity": "CRITICAL",
      "source_dom": { "selector": "Species Matrix" }
    },
    {
      "check_id": "CTR-001-10",
      "description": "Thành phần column keyword",
      "operator": "exists",
      "severity": "WARNING",
      "source_dom": { "selector": "Thành phần" }
    },
    {
      "check_id": "CTR-001-11",
      "description": "LAYER 1 badge present",
      "operator": "exists",
      "severity": "CRITICAL",
      "source_dom": { "selector": "LAYER 1" }
    },
    {
      "check_id": "CTR-001-12",
      "description": "Tổng nguyên tử label present",
      "operator": "exists",
      "severity": "CRITICAL",
      "source_dom": { "selector": "Tổng nguyên tử" }
    },
    {
      "check_id": "CTR-001-13",
      "description": "Phân loại loài label present",
      "operator": "exists",
      "severity": "CRITICAL",
      "source_dom": { "selector": "Phân loại loài" }
    },
    {
      "check_id": "CTR-001-14",
      "description": "Mồ côi (Orphan) label present",
      "operator": "exists",
      "severity": "WARNING",
      "source_dom": { "selector": "Mồ côi (Orphan)" }
    },
    {
      "check_id": "CTR-001-15",
      "description": "Changelog section present",
      "operator": "exists",
      "severity": "INFO",
      "source_dom": { "selector": "Nhật ký thay đổi" }
    }
  ]
}
